Codec: Analog Devices AD1984A
Address: 0
AFG Function Id: 0x1 (unsol 0)
Vendor Id: 0x11d4194a
Subsystem Id: 0x103c2a82
Revision Id: 0x100400
No Modem Function Group found
Default PCM:
    rates [0x7ff]: 8000 11025 16000 22050 32000 44100 48000 88200 96000 176400 192000
    bits [0xe]: 16 20 24
    formats [0x1]: PCM
Default Amp-In caps: ofs=0x00, nsteps=0x00, stepsize=0x00, mute=1
Default Amp-Out caps: ofs=0x27, nsteps=0x27, stepsize=0x05, mute=0
State of AFG node 0x01:
  Power states:  D0 D3
  Power: setting=D0, actual=D0
GPIO: io=3, o=0, i=0, unsolicited=1, wake=0
  IO[0]: enable=0, dir=0, wake=0, sticky=0, data=1, unsol=0
  IO[1]: enable=1, dir=1, wake=0, sticky=0, data=0, unsol=0
  IO[2]: enable=0, dir=0, wake=0, sticky=0, data=0, unsol=0
Node 0x02 [Audio Output] wcaps 0x30211: Stereo Digital
  Control: name="IEC958 Playback Con Mask", index=0, device=0
  Control: name="IEC958 Playback Pro Mask", index=0, device=0
  Control: name="IEC958 Playback Default", index=0, device=0
  Control: name="IEC958 Playback Switch", index=0, device=0
  Control: name="IEC958 Default PCM Playback Switch", index=0, device=0
  Device: name="AD1984A Digital", type="SPDIF", device=1
  Converter: stream=0, channel=0
  Digital:
  Digital category: 0x0
  IEC Coding Type: 0x0
  PCM:
    rates [0x7e0]: 44100 48000 88200 96000 176400 192000
    bits [0xe]: 16 20 24
    formats [0x5]: PCM AC3
  Delay: 3 samples
Node 0x03 [Audio Output] wcaps 0x405: Stereo Amp-Out
  Control: name="Speaker Playback Volume", index=0, device=0
    ControlAmp: chs=3, dir=Out, idx=0, ofs=0
  Device: name="AD1984A Analog", type="Audio", device=0
  Amp-Out caps: ofs=0x27, nsteps=0x27, stepsize=0x05, mute=0
  Amp-Out vals:  [0x25 0x25]
  Converter: stream=0, channel=0
  Power states:  D0 D3
  Power: setting=D0, actual=D0
Node 0x04 [Audio Output] wcaps 0x405: Stereo Amp-Out
  Control: name="Headphone Playback Volume", index=0, device=0
    ControlAmp: chs=3, dir=Out, idx=0, ofs=0
  Device: name="AD1984A Alt Analog", type="Audio", device=2
  Amp-Out caps: ofs=0x27, nsteps=0x27, stepsize=0x05, mute=0
  Amp-Out vals:  [0x00 0x00]
  Converter: stream=0, channel=0
  Power states:  D0 D3
  Power: setting=D0, actual=D0
Node 0x05 [Vendor Defined Widget] wcaps 0xf00000: Mono
Node 0x06 [Vendor Defined Widget] wcaps 0xf00000: Mono
Node 0x07 [Audio Mixer] wcaps 0x200103: Stereo Amp-In
  Amp-In caps: ofs=0x00, nsteps=0x00, stepsize=0x00, mute=1
  Amp-In vals:  [0x00 0x00] [0x80 0x80]
  Connection: 2
     0x22 0x21
Node 0x08 [Audio Input] wcaps 0x100501: Stereo
  Device: name="AD1984A Analog", type="Audio", device=0
  Converter: stream=0, channel=0
  SDI-Select: 0
  Power states:  D0 D3
  Power: setting=D0, actual=D0
  Connection: 1
     0x0c
Node 0x09 [Audio Input] wcaps 0x100501: Stereo
  Device: name="AD1984A Alt Analog", type="Audio", device=2
  Converter: stream=0, channel=0
  SDI-Select: 0
  Power states:  D0 D3
  Power: setting=D0, actual=D0
  Connection: 1
     0x0d
Node 0x0a [Audio Mixer] wcaps 0x200103: Stereo Amp-In
  Amp-In caps: ofs=0x00, nsteps=0x00, stepsize=0x00, mute=1
  Amp-In vals:  [0x80 0x80] [0x00 0x00]
  Connection: 2
     0x04 0x21
Node 0x0b [Audio Mixer] wcaps 0x200103: Stereo Amp-In
  Amp-In caps: ofs=0x00, nsteps=0x00, stepsize=0x00, mute=1
  Amp-In vals:  [0x00 0x00] [0x80 0x80]
  Connection: 2
     0x0f 0x21
Node 0x0c [Audio Selector] wcaps 0x30010d: Stereo Amp-Out
  Control: name="Capture Volume", index=0, device=0
    ControlAmp: chs=3, dir=Out, idx=0, ofs=0
  Control: name="Capture Switch", index=0, device=0
    ControlAmp: chs=3, dir=Out, idx=0, ofs=0
  Amp-Out caps: ofs=0x27, nsteps=0x36, stepsize=0x05, mute=1
  Amp-Out vals:  [0x26 0x26]
  Connection: 6
     0x14 0x15 0x16 0x20 0x25 0x17*
Node 0x0d [Audio Selector] wcaps 0x30010d: Stereo Amp-Out
  Control: name="Capture Volume", index=1, device=0
    ControlAmp: chs=3, dir=Out, idx=0, ofs=0
  Control: name="Capture Switch", index=1, device=0
    ControlAmp: chs=3, dir=Out, idx=0, ofs=0
  Amp-Out caps: ofs=0x27, nsteps=0x36, stepsize=0x05, mute=1
  Amp-Out vals:  [0x80 0x80]
  Connection: 6
     0x14 0x15 0x16 0x20 0x25 0x17*
Node 0x0e [Audio Selector] wcaps 0x300101: Stereo
  Connection: 2
     0x03* 0x04
Node 0x0f [Audio Selector] wcaps 0x300101: Stereo
  Connection: 2
     0x03* 0x04
Node 0x10 [Beep Generator Widget] wcaps 0x70000c: Mono Amp-Out
  Control: name="Beep Playback Volume", index=0, device=0
    ControlAmp: chs=1, dir=Out, idx=0, ofs=0
  Control: name="Beep Playback Switch", index=0, device=0
    ControlAmp: chs=1, dir=Out, idx=0, ofs=0
  Amp-Out caps: ofs=0x0f, nsteps=0x0f, stepsize=0x0b, mute=1
  Amp-Out vals:  [0x8f]
Node 0x11 [Pin Complex] wcaps 0x40018d: Stereo Amp-Out
  Control: name="Headphone Playback Switch", index=0, device=0
    ControlAmp: chs=3, dir=Out, idx=0, ofs=0
  Amp-Out caps: ofs=0x00, nsteps=0x00, stepsize=0x00, mute=1
  Amp-Out vals:  [0x80 0x80]
  Pincap 0x0000001f: OUT HP Detect Trigger ImpSense
  Pin Default 0x02214040: [Jack] HP Out at Ext Front
    Conn = 1/8, Color = Green
    DefAssociation = 0x4, Sequence = 0x0
  Pin-ctls: 0xc0: OUT HP
  Unsolicited: tag=01, enabled=1
  Connection: 1
     0x07
Node 0x12 [Pin Complex] wcaps 0x40058d: Stereo Amp-Out
  Control: name="Line Out Playback Switch", index=0, device=0
    ControlAmp: chs=3, dir=Out, idx=0, ofs=0
  Amp-Out caps: ofs=0x00, nsteps=0x00, stepsize=0x00, mute=1
  Amp-Out vals:  [0x00 0x00]
  Pincap 0x0001001f: OUT HP EAPD Detect Trigger ImpSense
  EAPD 0x0:
  Pin Default 0x01014010: [Jack] Line Out at Ext Rear
    Conn = 1/8, Color = Green
    DefAssociation = 0x1, Sequence = 0x0
  Pin-ctls: 0x40: OUT
  Unsolicited: tag=02, enabled=1
  Power states:  D0 D3
  Power: setting=D0, actual=D0
  Connection: 1
     0x0a
Node 0x13 [Pin Complex] wcaps 0x40050c: Mono Amp-Out
  Amp-Out caps: ofs=0x1f, nsteps=0x1f, stepsize=0x05, mute=1
  Amp-Out vals:  [0x9f]
  Pincap 0x00010010: OUT EAPD
  EAPD 0x0:
  Pin Default 0x511f11f0: [N/A] Speaker at Int Rear
    Conn = Other, Color = Black
    DefAssociation = 0xf, Sequence = 0x0
    Misc = NO_PRESENCE
  Pin-ctls: 0x40: OUT
  Power states:  D0 D3
  Power: setting=D0, actual=D0
  Connection: 1
     0x1f
Node 0x14 [Pin Complex] wcaps 0x40008b: Stereo Amp-In
  Amp-In caps: ofs=0x00, nsteps=0x03, stepsize=0x27, mute=0
  Amp-In vals:  [0x00 0x00]
  Pincap 0x00003727: IN Detect Trigger ImpSense
    Vref caps: HIZ 50 GRD 80 100
  Pin Default 0x418130f0: [N/A] Line In at Ext Rear
    Conn = 1/8, Color = Blue
    DefAssociation = 0xf, Sequence = 0x0
  Pin-ctls: 0x02: VREF_GRD
  Unsolicited: tag=00, enabled=0
Node 0x15 [Pin Complex] wcaps 0x40008b: Stereo Amp-In
  Amp-In caps: ofs=0x00, nsteps=0x03, stepsize=0x27, mute=0
  Amp-In vals:  [0x00 0x00]
  Pincap 0x00003727: IN Detect Trigger ImpSense
    Vref caps: HIZ 50 GRD 80 100
  Pin Default 0x418130f0: [N/A] Line In at Ext Rear
    Conn = 1/8, Color = Blue
    DefAssociation = 0xf, Sequence = 0x0
  Pin-ctls: 0x02: VREF_GRD
  Unsolicited: tag=00, enabled=0
Node 0x16 [Pin Complex] wcaps 0x40058d: Stereo Amp-Out
  Control: name="Speaker Playback Switch", index=0, device=0
    ControlAmp: chs=3, dir=Out, idx=0, ofs=0
  Amp-Out caps: ofs=0x00, nsteps=0x00, stepsize=0x00, mute=1
  Amp-Out vals:  [0x00 0x00]
  Pincap 0x00010037: IN OUT EAPD Detect Trigger ImpSense
  EAPD 0x2: EAPD
  Pin Default 0x9217411f: [Fixed] Speaker at Int Front
    Conn = Analog, Color = Green
    DefAssociation = 0x1, Sequence = 0xf
    Misc = NO_PRESENCE
  Pin-ctls: 0x40: OUT
  Unsolicited: tag=00, enabled=0
  Power states:  D0 D3
  Power: setting=D0, actual=D0
  Connection: 1
     0x0b
Node 0x17 [Pin Complex] wcaps 0x40020b: Stereo Digital Amp-In
  Amp-In caps: ofs=0x00, nsteps=0x03, stepsize=0x17, mute=0
