0a30: 00 00 00 00 00 00 00 00 00 00 00 00 00 00 00 00
0a40: 00 00 00 00 00 00 00 00 00 00 00 00 00 00 00 00
0a50: 00 00 00 00 00 00 00 00 00 00 00 00 00 00 00 00
0a60: 00 00 00 00 00 00 00 00 00 00 00 00 00 00 00 00
0a70: 00 00 00 00 00 00 00 00 00 00 00 00 00 00 00 00
0a80: 00 00 00 00 00 00 00 00 00 00 00 00 00 00 00 00
0a90: 00 00 00 00 00 00 00 00 00 00 00 00 00 00 00 00
0aa0: 00 00 00 00 00 00 00 00 00 00 00 00 00 00 00 00
0ab0: 00 00 00 00 00 00 00 00 00 00 00 00 00 00 00 00
0ac0: 00 00 00 00 00 00 00 00 00 00 00 00 00 00 00 00
0ad0: 00 00 00 00 00 00 00 00 00 00 00 00 00 00 00 00
0ae0: 00 00 00 00 00 00 00 00 00 00 00 00 00 00 00 00
0af0: 00 00 00 00 00 00 00 00 00 00 00 00 00 00 00 00
0b00: 00 00 00 00 00 00 00 00 00 00 00 00 00 00 00 00
0b10: 00 00 00 00 00 00 00 00 00 00 00 00 00 00 00 00
0b20: 00 00 00 00 00 00 00 00 00 00 00 00 00 00 00 00
0b30: 00 00 00 00 00 00 00 00 00 00 00 00 00 00 00 00
0b40: 00 00 00 00 00 00 00 00 00 00 00 00 00 00 00 00
0b50: 00 00 00 00 00 00 00 00 00 00 00 00 00 00 00 00
0b60: 00 00 00 00 00 00 00 00 00 00 00 00 00 00 00 00
0b70: 00 00 00 00 00 00 00 00 00 00 00 00 00 00 00 00
0b80: 00 00 00 00 00 00 00 00 00 00 00 00 00 00 00 00
0b90: 00 00 00 00 00 00 00 00 00 00 00 00 00 00 00 00
0ba0: 00 00 00 00 00 00 00 00 00 00 00 00 00 00 00 00
0bb0: 00 00 00 00 00 00 00 00 00 00 00 00 00 00 00 00
0bc0: 00 00 00 00 00 00 00 00 00 00 00 00 00 00 00 00
0bd0: 00 00 00 00 00 00 00 00 00 00 00 00 00 00 00 00
0be0: 00 00 00 00 00 00 00 00 00 00 00 00 00 00 00 00
0bf0: 00 00 00 00 00 00 00 00 00 00 00 00 00 00 00 00
0c00: 00 00 00 00 00 00 00 00 00 00 00 00 00 00 00 00
0c10: 00 00 00 00 00 00 00 00 00 00 00 00 00 00 00 00
0c20: 00 00 00 00 00 00 00 00 00 00 00 00 00 00 00 00
0c30: 00 00 00 00 00 00 00 00 00 00 00 00 00 00 00 00
0c40: 00 00 00 00 00 00 00 00 00 00 00 00 00 00 00 00
0c50: 00 00 00 00 00 00 00 00 00 00 00 00 00 00 00 00
0c60: 00 00 00 00 00 00 00 00 00 00 00 00 00 00 00 00
0c70: 00 00 00 00 00 00 00 00 00 00 00 00 00 00 00 00
0c80: 00 00 00 00 00 00 00 00 00 00 00 00 00 00 00 00
0c90: 00 00 00 00 00 00 00 00 00 00 00 00 00 00 00 00
0ca0: 00 00 00 00 00 00 00 00 00 00 00 00 00 00 00 00
0cb0: 00 00 00 00 00 00 00 00 00 00 00 00 00 00 00 00
0cc0: 00 00 00 00 00 00 00 00 00 00 00 00 00 00 00 00
0cd0: 00 00 00 00 00 00 00 00 00 00 00 00 00 00 00 00
0ce0: 00 00 00 00 00 00 00 00 00 00 00 00 00 00 00 00
0cf0: 00 00 00 00 00 00 00 00 00 00 00 00 00 00 00 00
0d00: 00 00 00 00 00 00 00 00 00 00 00 00 00 00 00 00
0d10: 00 00 00 00 00 00 00 00 00 00 00 00 00 00 00 00
0d20: 00 00 00 00 00 00 00 00 00 00 00 00 00 00 00 00
0d30: 00 00 00 00 00 00 00 00 00 00 00 00 00 00 00 00
0d40: 00 00 00 00 00 00 00 00 00 00 00 00 00 00 00 00
0d50: 00 00 00 00 00 00 00 00 00 00 00 00 00 00 00 00
0d60: 00 00 00 00 00 00 00 00 00 00 00 00 00 00 00 00
0d70: 00 00 00 00 00 00 00 00 00 00 00 00 00 00 00 00
0d80: 00 00 00 00 00 00 00 00 00 00 00 00 00 00 00 00
0d90: 00 00 00 00 00 00 00 00 00 00 00 00 00 00 00 00
0da0: 00 00 00 00 00 00 00 00 00 00 00 00 00 00 00 00
0db0: 00 00 00 00 00 00 00 00 00 00 00 00 00 00 00 00
0dc0: 00 00 00 00 00 00 00 00 00 00 00 00 00 00 00 00
0dd0: 00 00 00 00 00 00 00 00 00 00 00 00 00 00 00 00
0de0: 00 00 00 00 00 00 00 00 00 00 00 00 00 00 00 00
0df0: 00 00 00 00 00 00 00 00 00 00 00 00 00 00 00 00
0e00: 00 00 00 00 00 00 00 00 00 00 00 00 00 00 00 00
0e10: 00 00 00 00 00 00 00 00 00 00 00 00 00 00 00 00
0e20: 00 00 00 00 00 00 00 00 00 00 00 00 00 00 00 00
0e30: 00 00 00 00 00 00 00 00 00 00 00 00 00 00 00 00
0e40: 00 00 00 00 00 00 00 00 00 00 00 00 00 00 00 00
0e50: 00 00 00 00 00 00 00 00 00 00 00 00 00 00 00 00
0e60: 00 00 00 00 00 00 00 00 00 00 00 00 00 00 00 00
0e70: 00 00 00 00 00 00 00 00 00 00 00 00 00 00 00 00
0e80: 00 00 00 00 00 00 00 00 00 00 00 00 00 00 00 00
0e90: 00 00 00 00 00 00 00 00 00 00 00 00 00 00 00 00
0ea0: 00 00 00 00 00 00 00 00 00 00 00 00 00 00 00 00
0eb0: 00 00 00 00 00 00 00 00 00 00 00 00 00 00 00 00
0ec0: 00 00 00 00 00 00 00 00 00 00 00 00 00 00 00 00
0ed0: 00 00 00 00 00 00 00 00 00 00 00 00 00 00 00 00
0ee0: 00 00 00 00 00 00 00 00 00 00 00 00 00 00 00 00
0ef0: 00 00 00 00 00 00 00 00 00 00 00 00 00 00 00 00
0f00: 00 00 00 00 00 00 00 00 00 00 00 00 00 00 00 00
0f10: 00 00 00 00 00 00 00 00 00 00 00 00 00 00 00 00
0f20: 00 00 00 00 00 00 00 00 00 00 00 00 00 00 00 00
0f30: 00 00 00 00 00 00 00 00 00 00 00 00 00 00 00 00
0f40: 00 00 00 00 00 00 00 00 00 00 00 00 00 00 00 00
0f50: 00 00 00 00 00 00 00 00 00 00 00 00 00 00 00 00
0f60: 00 00 00 00 00 00 00 00 00 00 00 00 00 00 00 00
0f70: 00 00 00 00 00 00 00 00 00 00 00 00 00 00 00 00
0f80: 00 00 00 00 00 00 00 00 00 00 00 00 00 00 00 00
0f90: 00 00 00 00 00 00 00 00 00 00 00 00 00 00 00 00
0fa0: 00 00 00 00 00 00 00 00 00 00 00 00 00 00 00 00
0fb0: 00 00 00 00 00 00 00 00 00 00 00 00 00 00 00 00
0fc0: 00 00 00 00 00 00 00 00 00 00 00 00 00 00 00 00
0fd0: 00 00 00 00 00 00 00 00 00 00 00 00 00 00 00 00
0fe0: 00 00 00 00 00 00 00 00 00 00 00 00 00 00 00 00
0ff0: 00 00 00 00 00 00 00 00 00 00 00 00 00 00 00 00

PCIe 04:00.0 extended config space:
0000: 33 10 65 01 06 00 10 00 0b 00 00 04 08 00 00 00
0010: 04 e0 ef f9 00 00 00 00 04 d8 ef f9 00 00 00 00
0020: 00 00 00 00 00 00 00 00 00 00 00 00 61 14 0a 65
0030: 00 00 00 00 40 00 00 00 00 00 00 00 05 01 00 00
0040: 01 50 03 00 08 00 00 00 00 00 00 00 00 00 00 00
0050: 05 70 80 00 00 00 00 00 00 00 00 00 00 00 00 00
0060: 00 00 00 00 00 00 00 00 00 00 00 00 00 00 00 00
0070: 10 00 01 00 c0 8f 00 00 10 00 09 00 11 ec 07 00
0080: 00 00 11 10 00 00 00 00 00 00 00 00 00 00 00 00
0090: 00 00 00 00 00 00 00 00 00 00 00 00 00 00 00 00
00a0: 00 00 00 00 00 00 00 00 00 00 00 00 00 00 00 00
00b0: 00 00 00 00 00 00 00 00 00 00 00 00 00 00 00 00
00c0: 00 00 00 00 00 00 00 00 00 00 00 00 00 00 00 00
00d0: 00 00 00 00 00 00 00 00 00 00 00 00 00 00 00 00
00e0: 00 00 00 00 00 00 00 00 00 00 00 00 00 00 00 00
00f0: 00 00 00 00 00 00 00 00 00 00 00 00 00 00 00 00
0100: 01 00 01 14 00 00 00 00 00 00 00 00 30 20 06 00
0110: 00 20 00 00 00 20 00 00 00 00 00 00 00 00 00 00
0120: 00 00 00 00 00 00 00 00 00 00 00 00 00 00 00 00
0130: 00 00 00 00 00 00 00 00 00 00 00 00 00 00 00 00
0140: 03 00 01 00 00 00 00 00 00 4c 00 02 00 00 00 00
0150: 00 00 00 00 00 00 00 00 00 00 00 00 00 00 00 00
0160: 00 00 00 00 00 00 00 00 00 00 00 00 00 00 00 00
0170: 00 00 00 00 00 00 00 00 00 00 00 00 00 00 00 00
0180: 00 00 00 00 00 00 00 00 00 00 00 00 00 00 00 00
0190: 00 00 00 00 00 00 00 00 00 00 00 00 00 00 00 00
01a0: 00 00 00 00 00 00 00 00 00 00 00 00 00 00 00 00
01b0: 00 00 00 00 00 00 00 00 00 00 00 00 00 00 00 00
01c0: 00 00 00 00 00 00 00 00 00 00 00 00 00 00 00 00
01d0: 00 00 00 00 00 00 00 00 00 00 00 00 00 00 00 00
01e0: 00 00 00 00 00 00 00 00 00 00 00 00 00 00 00 00
01f0: 00 00 00 00 00 00 00 00 00 00 00 00 00 00 00 00
0200: 00 00 00 00 00 00 00 00 00 00 00 00 00 00 00 00
0210: 00 00 00 00 00 00 00 00 00 00 00 00 00 00 00 00
0220: 00 00 00 00 00 00 00 00 00 00 00 00 00 00 00 00
0230: 00 00 00 00 00 00 00 00 00 00 00 00 00 00 00 00
0240: 00 00 00 00 00 00 00 00 00 00 00 00 00 00 00 00
0250: 00 00 00 00 00 00 00 00 00 00 00 00 00 00 00 00
0260: 00 00 00 00 00 00 00 00 00 00 00 00 00 00 00 00
0270: 00 00 00 00 00 00 00 00 00 00 00 00 00 00 00 00
0280: 00 00 00 00 00 00 00 00 00 00 00 00 00 00 00 00
0290: 00 00 00 00 00 00 00 00 00 00 00 00 00 00 00 00
02a0: 00 00 00 00 00 00 00 00 00 00 00 00 00 00 00 00
02b0: 00 00 00 00 00 00 00 00 00 00 00 00 00 00 00 00
02c0: 00 00 00 00 00 00 00 00 00 00 00 00 00 00 00 00
02d0: 00 00 00 00 00 00 00 00 00 00 00 00 00 00 00 00
02e0: 00 00 00 00 00 00 00 00 00 00 00 00 00 00 00 00
02f0: 00 00 00 00 00 00 00 00 00 00 00 00 00 00 00 00
0300: 00 00 00 00 00 00 00 00 00 00 00 00 00 00 00 00
0310: 00 00 00 00 00 00 00 00 00 00 00 00 00 00 00 00
0320: 00 00 00 00 00 00 00 00 00 00 00 00 00 00 00 00
0330: 00 00 00 00 00 00 00 00 00 00 00 00 00 00 00 00
0340: 00 00 00 00 00 00 00 00 00 00 00 00 00 00 00 00
0350: 00 00 00 00 00 00 00 00 00 00 00 00 00 00 00 00
0360: 00 00 00 00 00 00 00 00 00 00 00 00 00 00 00 00
0370: 00 00 00 00 00 00 00 00 00 00 00 00 00 00 00 00
0380: 00 00 00 00 00 00 00 00 00 00 00 00 00 00 00 00
0390: 00 00 00 00 00 00 00 00 00 00 00 00 00 00 00 00
03a0: 00 00 00 00 00 00 00 00 00 00 00 00 00 00 00 00
03b0: 00 00 00 00 00 00 00 00 00 00 00 00 00 00 00 00
03c0: 00 00 00 00 00 00 00 00 00 00 00 00 00 00 00 00
03d0: 00 00 00 00 00 00 00 00 00 00 00 00 00 00 00 00
03e0: 00 00 00 00 00 00 00 00 00 00 00 00 00 00 00 00
03f0: 00 00 00 00 00 00 00 00 00 00 00 00 00 00 00 00
0400: 00 00 00 00 00 00 00 00 00 00 00 00 00 00 00 00
0410: 00 00 00 00 00 00 00 00 00 00 00 00 00 00 00 00
0420: 00 00 00 00 00 00 00 00 00 00 00 00 00 00 00 00
0430: 00 00 00 00 00 00 00 00 00 00 00 00 00 00 00 00
0440: 00 00 00 00 00 00 00 00 00 00 00 00 00 00 00 00
0450: 00 00 00 00 00 00 00 00 00 00 00 00 00 00 00 00
0460: 00 00 00 00 00 00 00 00 00 00 00 00 00 00 00 00
0470: 00 00 00 00 00 00 00 00 00 00 00 00 00 00 00 00
0480: 00 00 00 00 00 00 00 00 00 00 00 00 00 00 00 00
0490: 00 00 00 00 00 00 00 00 00 00 00 00 00 00 00 00
04a0: 00 00 00 00 00 00 00 00 00 00 00 00 00 00 00 00
04b0: 00 00 00 00 00 00 00 00 00 00 00 00 00 00 00 00
04c0: 00 00 00 00 00 00 00 00 00 00 00 00 00 00 00 00
04d0: 00 00 00 00 00 00 00 00 00 00 00 00 00 00 00 00
04e0: 00 00 00 00 00 00 00 00 00 00 00 00 00 00 00 00
04f0: 00 00 00 00 00 00 00 00 00 00 00 00 00 00 00 00
0500: 00 00 00 00 00 00 00 00 00 00 00 00 00 00 00 00
0510: 00 00 00 00 00 00 00 00 00 00 00 00 00 00 00 00
0520: 00 00 00 00 00 00 00 00 00 00 00 00 00 00 00 00
0530: 00 00 00 00 00 00 00 00 00 00 00 00 00 00 00 00
0540: 00 00 00 00 00 00 00 00 00 00 00 00 00 00 00 00
0550: 00 00 00 00 00 00 00 00 00 00 00 00 00 00 00 00
0560: 00 00 00 00 00 00 00 00 00 00 00 00 00 00 00 00
0570: 00 00 00 00 00 00 00 00 00 00 00 00 00 00 00 00
0580: 00 00 00 00 00 00 00 00 00 00 00 00 00 00 00 00
0590: 00 00 00 00 00 00 00 00 00 00 00 00 00 00 00 00
05a0: 00 00 00 00 00 00 00 00 00 00 00 00 00 00 00 00
05b0: 00 00 00 00 00 00 00 00 00 00 00 00 00 00 00 00
05c0: 00 00 00 00 00 00 00 00 00 00 00 00 00 00 00 00
05d0: 00 00 00 00 00 00 00 00 00 00 00 00 00 00 00 00
05e0: 00 00 00 00 00 00 00 00 00 00 00 00 00 00 00 00
05f0: 00 00 00 00 00 00 00 00 00 00 00 00 00 00 00 00
0600: 00 00 00 00 00 00 00 00 00 00 00 00 00 00 00 00
0610: 00 00 00 00 00 00 00 00 00 00 00 00 00 00 00 00
0620: 00 00 00 00 00 00 00 00 00 00 00 00 00 00 00 00
0630: 00 00 00 00 00 00 00 00 00 00 00 00 00 00 00 00
0640: 00 00 00 00 00 00 00 00 00 00 00 00 00 00 00 00
0650: 00 00 00 00 00 00 00 00 00 00 00 00 00 00 00 00
0660: 00 00 00 00 00 00 00 00 00 00 00 00 00 00 00 00
0670: 00 00 00 00 00 00 00 00 00 00 00 00 00 00 00 00
0680: 00 00 00 00 00 00 00 00 00 00 00 00 00 00 00 00
0690: 00 00 00 00 00 00 00 00 00 00 00 00 00 00 00 00
06a0: 00 00 00 00 00 00 00 00 00 00 00 00 00 00 00 00
06b0: 00 00 00 00 00 00 00 00 00 00 00 00 00 00 00 00
06c0: 00 00 00 00 00 00 00 00 00 00 00 00 00 00 00 00
06d0: 00 00 00 00 00 00 00 00 00 00 00 00 00 00 00 00
06e0: 00 00 00 00 00 00 00 00 00 00 00 00 00 00 00 00
06f0: 00 00 00 00 00 00 00 00 00 00 00 00 00 00 00 00
0700: 00 00 00 00 00 00 00 00 00 00 00 00 00 00 00 00
0710: 00 00 00 00 00 00 00 00 00 00 00 00 00 00 00 00
0720: 00 00 00 00 00 00 00 00 00 00 00 00 00 00 00 00
0730: 00 00 00 00 00 00 00 00 00 00 00 00 00 00 00 00
0740: 00 00 00 00 00 00 00 00 00 00 00 00 00 00 00 00
0750: 00 00 00 00 00 00 00 00 00 00 00 00 00 00 00 00
0760: 00 00 00 00 00 00 00 00 00 00 00 00 00 00 00 00
0770: 00 00 00 00 00 00 00 00 00 00 00 00 00 00 00 00
0780: 00 00 00 00 00 00 00 00 00 00 00 00 00 00 00 00
0790: 00 00 00 00 00 00 00 00 00 00 00 00 00 00 00 00
07a0: 00 00 00 00 00 00 00 00 00 00 00 00 00 00 00 00
07b0: 00 00 00 00 00 00 00 00 00 00 00 00 00 00 00 00
07c0: 00 00 00 00 00 00 00 00 00 00 00 00 00 00 00 00
07d0: 00 00 00 00 00 00 00 00 00 00 00 00 00 00 00 00
07e0: 00 00 00 00 00 00 00 00 00 00 00 00 00 00 00 00
07f0: 00 00 00 00 00 00 00 00 00 00 00 00 00 00 00 00
0800: 00 00 00 00 00 00 00 00 00 00 00 00 00 00 00 00
0810: 00 00 00 00 00 00 00 00 00 00 00 00 00 00 00 00
0820: 00 00 00 00 00 00 00 00 00 00 00 00 00 00 00 00
0830: 00 00 00 00 00 00 00 00 00 00 00 00 00 00 00 00
0840: 00 00 00 00 00 00 00 00 00 00 00 00 00 00 00 00
0850: 00 00 00 00 00 00 00 00 00 00 00 00 00 00 00 00
0860: 00 00 00 00 00 00 00 00 00 00 00 00 00 00 00 00
0870: 00 00 00 00 00 00 00 00 00 00 00 00 00 00 00 00
0880: 00 00 00 00 00 00 00 00 00 00 00 00 00 00 00 00
0890: 00 00 00 00 00 00 00 00 00 00 00 00 00 00 00 00
08a0: 00 00 00 00 00 00 00 00 00 00 00 00 00 00 00 00
08b0: 00 00 00 00 00 00 00 00 00 00 00 00 00 00 00 00
08c0: 00 00 00 00 00 00 00 00 00 00 00 00 00 00 00 00
08d0: 00 00 00 00 00 00 00 00 00 00 00 00 00 00 00 00
08e0: 00 00 00 00 00 00 00 00 00 00 00 00 00 00 00 00
08f0: 00 00 00 00 00 00 00 00 00 00 00 00 00 00 00 00
0900: 00 00 00 00 00 00 00 00 00 00 00 00 00 00 00 00
0910: 00 00 00 00 00 00 00 00 00 00 00 00 00 00 00 00
0920: 00 00 00 00 00 00 00 00 00 00 00 00 00 00 00 00
0930: 00 00 00 00 00 00 00 00 00 00 00 00 00 00 00 00
0940: 00 00 00 00 00 00 00 00 00 00 00 00 00 00 00 00
0950: 00 00 00 00 00 00 00 00 00 00 00 00 00 00 00 00
0960: 00 00 00 00 00 00 00 00 00 00 00 00 00 00 00 00
0970: 00 00 00 00 00 00 00 00 00 00 00 00 00 00 00 00
0980: 00 00 00 00 00 00 00 00 00 00 00 00 00 00 00 00
0990: 00 00 00 00 00 00 00 00 00 00 00 00 00 00 00 00
09a0: 00 00 00 00 00 00 00 00 00 00 00 00 00 00 00 00
09b0: 00 00 00 00 00 00 00 00 00 00 00 00 00 00 00 00
09c0: 00 00 00 00 00 00 00 00 00 00 00 00 00 00 00 00
09d0: 00 00 00 00 00 00 00 00 00 00 00 00 00 00 00 00
09e0: 00 00 00 00 00 00 00 00 00 00 00 00 00 00 00 00
09f0: 00 00 00 00 00 00 00 00 00 00 00 00 00 00 00 00
0a00: 00 00 00 00 00 00 00 00 00 00 00 00 00 00 00 00
0a10: 00 00 00 00 00 00 00 00 00 00 00 00 00 00 00 00
0a20: 00 00 00 00 00 00 00 00 00 00 00 00 00 00 00 00
0a30: 00 00 00 00 00 00 00 00 00 00 00 00 00 00 00 00
0a40: 00 00 00 00 00 00 00 00 00 00 00 00 00 00 00 00
0a50: 00 00 00 00 00 00 00 00 00 00 00 00 00 00 00 00
0a60: 00 00 00 00 00 00 00 00 00 00 00 00 00 00 00 00
0a70: 00 00 00 00 00 00 00 00 00 00 00 00 00 00 00 00
0a80: 00 00 00 00 00 00 00 00 00 00 00 00 00 00 00 00
0a90: 00 00 00 00 00 00 00 00 00 00 00 00 00 00 00 00
0aa0: 00 00 00 00 00 00 00 00 00 00 00 00 00 00 00 00
0ab0: 00 00 00 00 00 00 00 00 00 00 00 00 00 00 00 00
0ac0: 00 00 00 00 00 00 00 00 00 00 00 00 00 00 00 00
0ad0: 00 00 00 00 00 00 00 00 00 00 00 00 00 00 00 00
0ae0: 00 00 00 00 00 00 00 00 00 00 00 00 00 00 00 00
0af0: 00 00 00 00 00 00 00 00 00 00 00 00 00 00 00 00
0b00: 00 00 00 00 00 00 00 00 00 00 00 00 00 00 00 00
0b10: 00 00 00 00 00 00 00 00 00 00 00 00 00 00 00 00
0b20: 00 00 00 00 00 00 00 00 00 00 00 00 00 00 00 00
0b30: 00 00 00 00 00 00 00 00 00 00 00 00 00 00 00 00
0b40: 00 00 00 00 00 00 00 00 00 00 00 00 00 00 00 00
0b50: 00 00 00 00 00 00 00 00 00 00 00 00 00 00 00 00
0b60: 00 00 00 00 00 00 00 00 00 00 00 00 00 00 00 00
0b70: 00 00 00 00 00 00 00 00 00 00 00 00 00 00 00 00
0b80: 00 00 00 00 00 00 00 00 00 00 00 00 00 00 00 00
0b90: 00 00 00 00 00 00 00 00 00 00 00 00 00 00 00 00
0ba0: 00 00 00 00 00 00 00 00 00 00 00 00 00 00 00 00
0bb0: 00 00 00 00 00 00 00 00 00 00 00 00 00 00 00 00
0bc0: 00 00 00 00 00 00 00 00 00 00 00 00 00 00 00 00
0bd0: 00 00 00 00 00 00 00 00 00 00 00 00 00 00 00 00
0be0: 00 00 00 00 00 00 00 00 00 00 00 00 00 00 00 00
0bf0: 00 00 00 00 00 00 00 00 00 00 00 00 00 00 00 00
0c00: 00 00 00 00 00 00 00 00 00 00 00 00 00 00 00 00
0c10: 00 00 00 00 00 00 00 00 00 00 00 00 00 00 00 00
0c20: 00 00 00 00 00 00 00 00 00 00 00 00 00 00 00 00
0c30: 00 00 00 00 00 00 00 00 00 00 00 00 00 00 00 00
0c40: 00 00 00 00 00 00 00 00 00 00 00 00 00 00 00 00
0c50: 00 00 00 00 00 00 00 00 00 00 00 00 00 00 00 00
0c60: 00 00 00 00 00 00 00 00 00 00 00 00 00 00 00 00
0c70: 00 00 00 00 00 00 00 00 00 00 00 00 00 00 00 00
0c80: 00 00 00 00 00 00 00 00 00 00 00 00 00 00 00 00
0c90: 00 00 00 00 00 00 00 00 00 00 00 00 00 00 00 00
0ca0: 00 00 00 00 00 00 00 00 00 00 00 00 00 00 00 00
0cb0: 00 00 00 00 00 00 00 00 00 00 00 00 00 00 00 00
0cc0: 00 00 00 00 00 00 00 00 00 00 00 00 00 00 00 00
0cd0: 00 00 00 00 00 00 00 00 00 00 00 00 00 00 00 00
0ce0: 00 00 00 00 00 00 00 00 00 00 00 00 00 00 00 00
0cf0: 00 00 00 00 00 00 00 00 00 00 00 00 00 00 00 00
0d00: 00 00 00 00 00 00 00 00 00 00 00 00 00 00 00 00
0d10: 00 00 00 00 00 00 00 00 00 00 00 00 00 00 00 00
0d20: 00 00 00 00 00 00 00 00 00 00 00 00 00 00 00 00
0d30: 00 00 00 00 00 00 00 00 00 00 00 00 00 00 00 00
0d40: 00 00 00 00 00 00 00 00 00 00 00 00 00 00 00 00
0d50: 00 00 00 00 00 00 00 00 00 00 00 00 00 00 00 00
0d60: 00 00 00 00 00 00 00 00 00 00 00 00 00 00 00 00
0d70: 00 00 00 00 00 00 00 00 00 00 00 00 00 00 00 00
0d80: 00 00 00 00 00 00 00 00 00 00 00 00 00 00 00 00
0d90: 00 00 00 00 00 00 00 00 00 00 00 00 00 00 00 00
0da0: 00 00 00 00 00 00 00 00 00 00 00 00 00 00 00 00
0db0: 00 00 00 00 00 00 00 00 00 00 00 00 00 00 00 00
0dc0: 00 00 00 00 00 00 00 00 00 00 00 00 00 00 00 00
0dd0: 00 00 00 00 00 00 00 00 00 00 00 00 00 00 00 00
0de0: 00 00 00 00 00 00 00 00 00 00 00 00 00 00 00 00
0df0: 00 00 00 00 00 00 00 00 00 00 00 00 00 00 00 00
0e00: 00 00 00 00 00 00 00 00 00 00 00 00 00 00 00 00
0e10: 00 00 00 00 00 00 00 00 00 00 00 00 00 00 00 00
0e20: 00 00 00 00 00 00 00 00 00 00 00 00 00 00 00 00
0e30: 00 00 00 00 00 00 00 00 00 00 00 00 00 00 00 00
0e40: 00 00 00 00 00 00 00 00 00 00 00 00 00 00 00 00
0e50: 00 00 00 00 00 00 00 00 00 00 00 00 00 00 00 00
0e60: 00 00 00 00 00 00 00 00 00 00 00 00 00 00 00 00
0e70: 00 00 00 00 00 00 00 00 00 00 00 00 00 00 00 00
0e80: 00 00 00 00 00 00 00 00 00 00 00 00 00 00 00 00
0e90: 00 00 00 00 00 00 00 00 00 00 00 00 00 00 00 00
0ea0: 00 00 00 00 00 00 00 00 00 00 00 00 00 00 00 00
0eb0: 00 00 00 00 00 00 00 00 00 00 00 00 00 00 00 00
0ec0: 00 00 00 00 00 00 00 00 00 00 00 00 00 00 00 00
0ed0: 00 00 00 00 00 00 00 00 00 00 00 00 00 00 00 00
0ee0: 00 00 00 00 00 00 00 00 00 00 00 00 00 00 00 00
0ef0: 00 00 00 00 00 00 00 00 00 00 00 00 00 00 00 00
0f00: 00 00 00 00 00 00 00 00 00 00 00 00 00 00 00 00
0f10: 00 00 00 00 00 00 00 00 00 00 00 00 00 00 00 00
0f20: 00 00 00 00 00 00 00 00 00 00 00 00 00 00 00 00
0f30: 00 00 00 00 00 00 00 00 00 00 00 00 00 00 00 00
0f40: 00 00 00 00 00 00 00 00 00 00 00 00 00 00 00 00
0f50: 00 00 00 00 00 00 00 00 00 00 00 00 00 00 00 00
0f60: 00 00 00 00 00 00 00 00 00 00 00 00 00 00 00 00
0f70: 00 00 00 00 00 00 00 00 00 00 00 00 00 00 00 00
0f80: 00 00 00 00 00 00 00 00 00 00 00 00 00 00 00 00
0f90: 00 00 00 00 00 00 00 00 00 00 00 00 00 00 00 00
0fa0: 00 00 00 00 00 00 00 00 00 00 00 00 00 00 00 00
0fb0: 00 00 00 00 00 00 00 00 00 00 00 00 00 00 00 00
0fc0: 00 00 00 00 00 00 00 00 00 00 00 00 00 00 00 00
0fd0: 00 00 00 00 00 00 00 00 00 00 00 00 00 00 00 00
0fe0: 00 00 00 00 00 00 00 00 00 00 00 00 00 00 00 00
0ff0: 00 00 00 00 00 00 00 00 00 00 00 00 00 00 00 00

PCIe 05:00.0 extended config space:
0000: 14 18 81 07 07 00 10 00 00 00 80 02 08 00 00 00
0010: 00 00 ff f9 00 00 00 00 00 00 00 00 00 00 00 00
0020: 00 00 00 00 00 00 00 00 00 00 00 00 14 18 90 27
0030: 00 00 00 00 40 00 00 00 00 00 00 00 0a 01 00 00
0040: 01 50 c3 49 00 80 00 00 00 00 00 00 00 00 00 00
0050: 05 70 8a 00 00 00 00 00 00 00 00 00 00 00 00 00
0060: 00 00 00 00 00 00 00 00 00 00 00 00 00 00 00 00
0070: 10 00 01 00 40 82 28 00 10 20 09 00 11 3c 07 00
0080: 08 00 11 10 00 00 00 00 c0 03 00 00 00 00 00 00
0090: 00 00 00 00 00 00 00 00 00 00 00 00 00 00 00 00
00a0: 00 00 00 00 00 00 00 00 00 00 00 00 00 00 00 00
00b0: 04 00 00 00 00 00 00 00 00 00 00 00 00 00 00 00
00c0: 00 00 00 00 00 00 00 00 00 00 00 00 00 00 00 00
00d0: 00 00 00 00 00 00 00 00 00 00 00 00 00 00 00 00
00e0: 00 00 00 00 00 00 00 00 00 00 00 00 00 00 00 00
00f0: 00 00 00 00 00 00 00 00 00 00 00 00 00 00 00 00
0100: 01 00 01 00 00 00 10 00 00 00 00 00 10 20 06 00
0110: 00 20 00 00 00 20 00 00 a0 00 00 00 00 00 00 00
0120: 00 00 00 00 00 00 00 00 00 00 00 00 00 00 00 00
0130: 00 00 00 00 00 00 00 00 00 00 00 00 00 00 00 00
0140: 00 00 00 00 00 00 00 00 00 00 00 00 00 00 00 00
0150: 00 00 00 00 00 00 00 00 00 00 00 00 00 00 00 00
0160: 00 00 00 00 00 00 00 00 00 00 00 00 00 00 00 00
0170: 00 00 00 00 00 00 00 00 00 00 00 00 00 00 00 00
0180: 00 00 00 00 00 00 00 00 00 00 00 00 00 00 00 00
0190: 00 00 00 00 00 00 00 00 00 00 00 00 00 00 00 00
01a0: 00 00 00 00 00 00 00 00 00 00 00 00 00 00 00 00
01b0: 00 00 00 00 00 00 00 00 00 00 00 00 00 00 00 00
01c0: 00 00 00 00 00 00 00 00 00 00 00 00 00 00 00 00
01d0: 00 00 00 00 00 00 00 00 00 00 00 00 00 00 00 00
01e0: 00 00 00 00 00 00 00 00 00 00 00 00 00 00 00 00
01f0: 00 00 00 00 00 00 00 00 00 00 00 00 00 00 00 00
0200: 00 00 00 00 00 00 00 00 00 00 00 00 00 00 00 00
0210: 00 00 00 00 00 00 00 00 00 00 00 00 00 00 00 00
0220: 00 00 00 00 00 00 00 00 00 00 00 00 00 00 00 00
0230: 00 00 00 00 00 00 00 00 00 00 00 00 00 00 00 00
0240: 00 00 00 00 00 00 00 00 00 00 00 00 00 00 00 00
0250: 00 00 00 00 00 00 00 00 00 00 00 00 00 00 00 00
0260: 00 00 00 00 00 00 00 00 00 00 00 00 00 00 00 00
0270: 00 00 00 00 00 00 00 00 00 00 00 00 00 00 00 00
0280: 00 00 00 00 00 00 00 00 00 00 00 00 00 00 00 00
0290: 00 00 00 00 00 00 00 00 00 00 00 00 00 00 00 00
02a0: 00 00 00 00 00 00 00 00 00 00 00 00 00 00 00 00
02b0: 00 00 00 00 00 00 00 00 00 00 00 00 00 00 00 00
02c0: 00 00 00 00 00 00 00 00 00 00 00 00 00 00 00 00
02d0: 00 00 00 00 00 00 00 00 00 00 00 00 00 00 00 00
02e0: 00 00 00 00 00 00 00 00 00 00 00 00 00 00 00 00
02f0: 00 00 00 00 00 00 00 00 00 00 00 00 00 00 00 00
0300: 00 00 00 00 00 00 00 00 00 00 00 00 00 00 00 00
0310: 00 00 00 00 00 00 00 00 00 00 00 00 00 00 00 00
0320: 00 00 00 00 00 00 00 00 00 00 00 00 00 00 00 00
0330: 00 00 00 00 00 00 00 00 00 00 00 00 00 00 00 00
0340: 00 00 00 00 00 00 00 00 00 00 00 00 00 00 00 00
0350: 00 00 00 00 00 00 00 00 00 00 00 00 00 00 00 00
0360: 00 00 00 00 00 00 00 00 00 00 00 00 00 00 00 00
0370: 00 00 00 00 00 00 00 00 00 00 00 00 00 00 00 00
0380: 00 00 00 00 00 00 00 00 00 00 00 00 00 00 00 00
0390: 00 00 00 00 00 00 00 00 00 00 00 00 00 00 00 00
03a0: 00 00 00 00 00 00 00 00 00 00 00 00 00 00 00 00
03b0: 00 00 00 00 00 00 00 00 00 00 00 00 00 00 00 00
03c0: 00 00 00 00 00 00 00 00 00 00 00 00 00 00 00 00
03d0: 00 00 00 00 00 00 00 00 00 00 00 00 00 00 00 00
03e0: 00 00 00 00 00 00 00 00 00 00 00 00 00 00 00 00
03f0: 00 00 00 00 00 00 00 00 00 00 00 00 00 00 00 00
0400: 00 00 00 00 00 00 00 00 00 00 00 00 00 00 00 00
0410: 00 00 00 00 00 00 00 00 00 00 00 00 00 00 00 00
0420: 00 00 00 00 00 00 00 00 00 00 00 00 00 00 00 00
0430: 00 00 00 00 00 00 00 00 00 00 00 00 00 00 00 00
0440: 00 00 00 00 00 00 00 00 00 00 00 00 00 00 00 00
0450: 00 00 00 00 00 00 00 00 00 00 00 00 00 00 00 00
0460: 00 00 00 00 00 00 00 00 00 00 00 00 00 00 00 00
0470: 00 00 00 00 00 00 00 00 00 00 00 00 00 00 00 00
0480: 00 00 00 00 00 00 00 00 00 00 00 00 00 00 00 00
0490: 00 00 00 00 00 00 00 00 00 00 00 00 00 00 00 00
04a0: 00 00 00 00 00 00 00 00 00 00 00 00 00 00 00 00
04b0: 00 00 00 00 00 00 00 00 00 00 00 00 00 00 00 00
04c0: 00 00 00 00 00 00 00 00 00 00 00 00 00 00 00 00
04d0: 00 00 00 00 00 00 00 00 00 00 00 00 00 00 00 00
04e0: 00 00 00 00 00 00 00 00 00 00 00 00 00 00 00 00
04f0: 00 00 00 00 00 00 00 00 00 00 00 00 00 00 00 00
0500: 00 00 00 00 00 00 00 00 00 00 00 00 00 00 00 00
0510: 00 00 00 00 00 00 00 00 00 00 00 00 00 00 00 00
0520: 00 00 00 00 00 00 00 00 00 00 00 00 00 00 00 00
0530: 00 00 00 00 00 00 00 00 00 00 00 00 00 00 00 00
0540: 00 00 00 00 00 00 00 00 00 00 00 00 00 00 00 00
0550: 00 00 00 00 00 00 00 00 00 00 00 00 00 00 00 00
0560: 00 00 00 00 00 00 00 00 00 00 00 00 00 00 00 00
0570: 00 00 00 00 00 00 00 00 00 00 00 00 00 00 00 00
0580: 00 00 00 00 00 00 00 00 00 00 00 00 00 00 00 00
0590: 00 00 00 00 00 00 00 00 00 00 00 00 00 00 00 00
05a0: 00 00 00 00 00 00 00 00 00 00 00 00 00 00 00 00
05b0: 00 00 00 00 00 00 00 00 00 00 00 00 00 00 00 00
05c0: 00 00 00 00 00 00 00 00 00 00 00 00 00 00 00 00
05d0: 00 00 00 00 00 00 00 00 00 00 00 00 00 00 00 00
05e0: 00 00 00 00 00 00 00 00 00 00 00 00 00 00 00 00
05f0: 00 00 00 00 00 00 00 00 00 00 00 00 00 00 00 00
0600: 00 00 00 00 00 00 00 00 00 00 00 00 00 00 00 00
0610: 00 00 00 00 00 00 00 00 00 00 00 00 00 00 00 00
0620: 00 00 00 00 00 00 00 00 00 00 00 00 00 00 00 00
0630: 00 00 00 00 00 00 00 00 00 00 00 00 00 00 00 00
0640: 00 00 00 00 00 00 00 00 00 00 00 00 00 00 00 00
0650: 00 00 00 00 00 00 00 00 00 00 00 00 00 00 00 00
0660: 00 00 00 00 00 00 00 00 00 00 00 00 00 00 00 00
0670: 00 00 00 00 00 00 00 00 00 00 00 00 00 00 00 00
0680: 00 00 00 00 00 00 00 00 00 00 00 00 00 00 00 00
0690: 00 00 00 00 00 00 00 00 00 00 00 00 00 00 00 00
06a0: 00 00 00 00 00 00 00 00 00 00 00 00 00 00 00 00
06b0: 00 00 00 00 00 00 00 00 00 00 00 00 00 00 00 00
06c0: 00 00 00 00 00 00 00 00 00 00 00 00 00 00 00 00
06d0: 00 00 00 00 00 00 00 00 00 00 00 00 00 00 00 00
06e0: 00 00 00 00 00 00 00 00 00 00 00 00 00 00 00 00
06f0: 00 00 00 00 00 00 00 00 00 00 00 00 00 00 00 00
0700: 76 00 63 01 ff ff ff ff 04 00 00 00 01 0f 00 13
0710: 20 01 01 00 00 00 00 00 aa 43 00 20 80 02 00 00
0720: 00 00 00 00 00 00 00 00 51 5c 1e 01 10 00 00 08
0730: 10 40 00 00 01 40 00 00 ff ff 0f 00 00 00 00 00
0740: 0f 00 00 00 00 00 00 00 19 b0 20 00 03 b0 20 00
0750: 00 00 20 00 00 00 00 00 00 00 00 00 00 00 00 00
0760: 00 00 00 00 00 00 00 00 00 00 00 00 00 00 00 00
0770: 00 00 00 00 00 00 00 00 00 00 00 00 00 00 00 00
0780: 00 00 00 00 00 00 00 00 00 00 00 00 00 00 00 00
0790: 00 00 00 00 00 00 00 00 00 00 00 00 00 00 00 00
07a0: 00 00 00 00 00 00 00 00 90 00 17 00 00 00 00 00
07b0: 00 00 00 00 00 00 00 00 00 00 00 00 00 00 00 00
07c0: 00 00 00 00 00 00 00 00 00 00 00 00 00 00 00 00
07d0: 00 00 00 00 00 00 00 00 00 00 00 00 00 00 00 00
07e0: 00 00 00 00 00 00 00 00 00 00 00 00 00 00 00 00
07f0: 00 00 00 00 00 00 00 00 00 00 00 00 00 00 00 00
0800: 00 00 00 00 00 00 00 00 00 00 00 00 00 00 00 00
0810: 00 00 00 00 00 00 00 00 00 00 00 00 00 00 00 00
0820: 00 00 00 00 00 00 00 00 00 00 00 00 00 00 00 00
0830: 00 00 00 00 00 00 00 00 00 00 00 00 00 00 00 00
0840: 00 00 00 00 00 00 00 00 00 00 00 00 00 00 00 00
0850: 00 00 00 00 00 00 00 00 00 00 00 00 00 00 00 00
0860: 00 00 00 00 00 00 00 00 00 00 00 00 00 00 00 00
0870: 00 00 00 00 00 00 00 00 00 00 00 00 00 00 00 00
0880: 00 00 00 00 00 00 00 00 00 00 00 00 00 00 00 00
0890: 00 00 00 00 00 00 00 00 00 00 00 00 00 00 00 00
08a0: 00 00 00 00 00 00 00 00 00 00 00 00 00 00 00 00
08b0: 00 00 00 00 00 00 00 00 00 00 00 00 00 00 00 00
08c0: 00 00 00 00 00 00 00 00 00 00 00 00 00 00 00 00
08d0: 00 00 00 00 00 00 00 00 00 00 00 00 00 00 00 00
08e0: 00 00 00 00 00 00 00 00 00 00 00 00 00 00 00 00
08f0: 00 00 00 00 00 00 00 00 00 00 00 00 00 00 00 00
0900: 00 00 00 00 00 00 00 00 00 00 00 00 00 00 00 00
0910: 00 00 00 00 00 00 00 00 00 00 00 00 00 00 00 00
0920: 00 00 00 00 00 00 00 00 00 00 00 00 00 00 00 00
0930: 00 00 00 00 00 00 00 00 00 00 00 00 00 00 00 00
0940: 00 00 00 00 00 00 00 00 00 00 00 00 00 00 00 00
0950: 00 00 00 00 00 00 00 00 00 00 00 00 00 00 00 00
0960: 00 00 00 00 00 00 00 00 00 00 00 00 00 00 00 00
0970: 00 00 00 00 00 00 00 00 00 00 00 00 00 00 00 00
0980: 00 00 00 00 00 00 00 00 00 00 00 00 00 00 00 00
0990: 00 00 00 00 00 00 00 00 00 00 00 00 00 00 00 00
09a0: 00 00 00 00 00 00 00 00 00 00 00 00 00 00 00 00
09b0: 00 00 00 00 00 00 00 00 00 00 00 00 00 00 00 00
09c0: 00 00 00 00 00 00 00 00 00 00 00 00 00 00 00 00
09d0: 00 00 00 00 00 00 00 00 00 00 00 00 00 00 00 00
09e0: 00 00 00 00 00 00 00 00 00 00 00 00 00 00 00 00
09f0: 00 00 00 00 00 00 00 00 00 00 00 00 00 00 00 00
0a00: 00 00 00 00 00 00 00 00 00 00 00 00 00 00 00 00
0a10: 00 00 00 00 00 00 00 00 00 00 00 00 00 00 00 00
0a20: 00 00 00 00 00 00 00 00 00 00 00 00 00 00 00 00
0a30: 00 00 00 00 00 00 00 00 00 00 00 00 00 00 00 00
0a40: 00 00 00 00 00 00 00 00 00 00 00 00 00 00 00 00
0a50: 00 00 00 00 00 00 00 00 00 00 00 00 00 00 00 00
0a60: 00 00 00 00 00 00 00 00 00 00 00 00 00 00 00 00
0a70: 00 00 00 00 00 00 00 00 00 00 00 00 00 00 00 00
0a80: 00 00 00 00 00 00 00 00 00 00 00 00 00 00 00 00
0a90: 00 00 00 00 00 00 00 00 00 00 00 00 00 00 00 00
0aa0: 00 00 00 00 00 00 00 00 00 00 00 00 00 00 00 00
0ab0: 00 00 00 00 00 00 00 00 00 00 00 00 00 00 00 00
0ac0: 00 00 00 00 00 00 00 00 00 00 00 00 00 00 00 00
0ad0: 00 00 00 00 00 00 00 00 00 00 00 00 00 00 00 00
0ae0: 00 00 00 00 00 00 00 00 00 00 00 00 00 00 00 00
0af0: 00 00 00 00 00 00 00 00 00 00 00 00 00 00 00 00
0b00: 00 00 00 00 00 00 00 00 00 00 00 00 00 00 00 00
0b10: 00 00 00 00 00 00 00 00 00 00 00 00 00 00 00 00
0b20: 00 00 00 00 00 00 00 00 00 00 00 00 00 00 00 00
0b30: 00 00 00 00 00 00 00 00 00 00 00 00 00 00 00 00
0b40: 00 00 00 00 00 00 00 00 00 00 00 00 00 00 00 00
0b50: 00 00 00 00 00 00 00 00 00 00 00 00 00 00 00 00
0b60: 00 00 00 00 00 00 00 00 00 00 00 00 00 00 00 00
0b70: 00 00 00 00 00 00 00 00 00 00 00 00 00 00 00 00
0b80: 00 00 00 00 00 00 00 00 00 00 00 00 00 00 00 00
0b90: 00 00 00 00 00 00 00 00 00 00 00 00 00 00 00 00
0ba0: 00 00 00 00 00 00 00 00 00 00 00 00 00 00 00 00
0bb0: 00 00 00 00 00 00 00 00 00 00 00 00 00 00 00 00
0bc0: 00 00 00 00 00 00 00 00 00 00 00 00 00 00 00 00
0bd0: 00 00 00 00 00 00 00 00 00 00 00 00 00 00 00 00
0be0: 00 00 00 00 00 00 00 00 00 00 00 00 00 00 00 00
0bf0: 00 00 00 00 00 00 00 00 00 00 00 00 00 00 00 00
0c00: 00 00 00 00 00 00 00 00 00 00 00 00 00 00 00 00
0c10: 00 00 00 00 00 00 00 00 00 00 00 00 00 00 00 00
0c20: 00 00 00 00 00 00 00 00 00 00 00 00 00 00 00 00
0c30: 00 00 00 00 00 00 00 00 00 00 00 00 00 00 00 00
0c40: 00 00 00 00 00 00 00 00 00 00 00 00 00 00 00 00
0c50: 00 00 00 00 00 00 00 00 00 00 00 00 00 00 00 00
0c60: 00 00 00 00 00 00 00 00 00 00 00 00 00 00 00 00
0c70: 00 00 00 00 00 00 00 00 00 00 00 00 00 00 00 00
0c80: 00 00 00 00 00 00 00 00 00 00 00 00 00 00 00 00
0c90: 00 00 00 00 00 00 00 00 00 00 00 00 00 00 00 00
0ca0: 00 00 00 00 00 00 00 00 00 00 00 00 00 00 00 00
0cb0: 00 00 00 00 00 00 00 00 00 00 00 00 00 00 00 00
0cc0: 00 00 00 00 00 00 00 00 00 00 00 00 00 00 00 00
0cd0: 00 00 00 00 00 00 00 00 00 00 00 00 00 00 00 00
0ce0: 00 00 00 00 00 00 00 00 00 00 00 00 00 00 00 00
0cf0: 00 00 00 00 00 00 00 00 00 00 00 00 00 00 00 00
0d00: 00 00 00 00 00 00 00 00 00 00 00 00 00 00 00 00
0d10: 00 00 00 00 00 00 00 00 00 00 00 00 00 00 00 00
0d20: 00 00 00 00 00 00 00 00 00 00 00 00 00 00 00 00
0d30: 00 00 00 00 00 00 00 00 00 00 00 00 00 00 00 00
0d40: 00 00 00 00 00 00 00 00 00 00 00 00 00 00 00 00
0d50: 00 00 00 00 00 00 00 00 00 00 00 00 00 00 00 00
0d60: 00 00 00 00 00 00 00 00 00 00 00 00 00 00 00 00
0d70: 00 00 00 00 00 00 00 00 00 00 00 00 00 00 00 00
0d80: 00 00 00 00 00 00 00 00 00 00 00 00 00 00 00 00
0d90: 00 00 00 00 00 00 00 00 00 00 00 00 00 00 00 00
0da0: 00 00 00 00 00 00 00 00 00 00 00 00 00 00 00 00
0db0: 00 00 00 00 00 00 00 00 00 00 00 00 00 00 00 00
0dc0: 00 00 00 00 00 00 00 00 00 00 00 00 00 00 00 00
0dd0: 00 00 00 00 00 00 00 00 00 00 00 00 00 00 00 00
0de0: 00 00 00 00 00 00 00 00 00 00 00 00 00 00 00 00
0df0: 00 00 00 00 00 00 00 00 00 00 00 00 00 00 00 00
0e00: 00 00 00 00 00 00 00 00 00 00 00 00 00 00 00 00
0e10: 00 00 00 00 00 00 00 00 00 00 00 00 00 00 00 00
0e20: 00 00 00 00 00 00 00 00 00 00 00 00 00 00 00 00
0e30: 00 00 00 00 00 00 00 00 00 00 00 00 00 00 00 00
0e40: 00 00 00 00 00 00 00 00 00 00 00 00 00 00 00 00
0e50: 00 00 00 00 00 00 00 00 00 00 00 00 00 00 00 00
0e60: 00 00 00 00 00 00 00 00 00 00 00 00 00 00 00 00
0e70: 00 00 00 00 00 00 00 00 00 00 00 00 00 00 00 00
0e80: 00 00 00 00 00 00 00 00 00 00 00 00 00 00 00 00
0e90: 00 00 00 00 00 00 00 00 00 00 00 00 00 00 00 00
0ea0: 00 00 00 00 00 00 00 00 00 00 00 00 00 00 00 00
0eb0: 00 00 00 00 00 00 00 00 00 00 00 00 00 00 00 00
0ec0: 00 00 00 00 00 00 00 00 00 00 00 00 00 00 00 00
0ed0: 00 00 00 00 00 00 00 00 00 00 00 00 00 00 00 00
0ee0: 00 00 00 00 00 00 00 00 00 00 00 00 00 00 00 00
0ef0: 00 00 00 00 00 00 00 00 00 00 00 00 00 00 00 00
0f00: 00 00 00 00 00 00 00 00 00 00 00 00 00 00 00 00
0f10: 00 00 00 00 00 00 00 00 00 00 00 00 00 00 00 00
0f20: 00 00 00 00 00 00 00 00 00 00 00 00 00 00 00 00
0f30: 00 00 00 00 00 00 00 00 00 00 00 00 00 00 00 00
0f40: 00 00 00 00 00 00 00 00 00 00 00 00 00 00 00 00
0f50: 00 00 00 00 00 00 00 00 00 00 00 00 00 00 00 00
0f60: 00 00 00 00 00 00 00 00 00 00 00 00 00 00 00 00
0f70: 00 00 00 00 00 00 00 00 00 00 00 00 00 00 00 00
0f80: 00 00 00 00 00 00 00 00 00 00 00 00 00 00 00 00
0f90: 00 00 00 00 00 00 00 00 00 00 00 00 00 00 00 00
0fa0: 00 00 00 00 00 00 00 00 00 00 00 00 00 00 00 00
0fb0: 00 00 00 00 00 00 00 00 00 00 00 00 00 00 00 00
0fc0: 00 00 00 00 00 00 00 00 00 00 00 00 00 00 00 00
0fd0: 00 00 00 00 00 00 00 00 00 00 00 00 00 00 00 00
0fe0: 00 00 00 00 00 00 00 00 00 00 00 00 00 00 00 00
0ff0: 00 00 00 00 00 00 00 00 00 00 00 00 00 00 00 00

PCIe 06:00.0 extended config space:
0000: de 10 e9 06 07 00 10 00 a1 00 00 03 00 00 00 00
0010: 00 00 00 fd 0c 00 00 d0 00 00 00 00 04 00 00 fa
0020: 00 00 00 00 01 ec 00 00 00 00 00 00 0a 1b 10 90
0030: 00 00 00 00 60 00 00 00 00 00 00 00 0a 01 00 00
0040: 0a 1b 10 90 00 00 00 00 00 00 00 00 00 00 00 00
0050: 01 00 00 00 01 00 00 00 ce d6 23 00 00 00 00 00
0060: 01 68 03 00 08 00 00 00 05 78 81 00 00 10 e0 fe
0070: 00 00 00 00 25 00 00 00 10 00 02 00 a0 84 00 00
0080: 10 29 00 00 01 2d 00 00 48 00 01 11 00 00 00 00
0090: 00 00 00 00 00 00 00 00 00 00 00 00 10 00 00 00
00a0: 00 00 00 00 00 00 00 00 01 00 00 00 00 00 00 00
00b0: 00 00 00 00 00 00 00 00 00 00 00 00 00 00 00 00
00c0: 00 00 00 00 00 00 00 00 00 00 00 00 00 00 00 00
00d0: 00 00 00 00 00 00 00 00 00 00 00 00 00 00 00 00
00e0: 00 00 00 00 00 00 00 00 00 00 00 00 00 00 00 00
00f0: 00 00 00 00 00 00 00 00 00 00 00 00 00 00 00 00
0100: 02 00 81 12 00 00 00 00 00 00 00 00 00 00 00 00
0110: 00 00 00 00 01 00 00 80 00 00 00 00 00 00 00 00
0120: 00 00 00 00 00 00 00 00 04 00 01 60 00 00 00 00
0130: 21 81 07 00 00 00 00 00 00 00 01 30 00 00 ff 53
0140: 00 00 01 08 10 00 00 00 ff ff ff ff 1b 00 00 8b
0150: 15 fe 00 60 01 00 00 00 02 01 00 00 21 81 07 00
0160: 21 81 05 00 02 80 03 00 02 80 01 00 06 80 1f 00
0170: 06 80 1d 00 00 00 00 00 00 00 00 00 00 00 00 00
0180: 00 00 00 00 00 00 00 00 44 00 00 00 07 00 00 e0
0190: 10 10 10 10 00 00 00 01 00 00 00 00 00 00 00 00
01a0: 00 00 00 00 00 00 00 00 00 00 00 00 00 00 00 00
01b0: 00 00 00 00 00 00 00 00 00 00 00 00 00 00 00 00
01c0: 00 00 00 00 00 00 00 00 00 00 00 00 00 00 00 00
01d0: 00 00 00 00 00 00 00 00 00 00 00 00 00 00 00 00
01e0: 74 00 00 00 74 00 00 00 74 00 00 00 00 00 00 00
01f0: 7c 00 e0 01 00 00 00 00 00 00 00 00 00 00 00 00
0200: 00 00 00 00 00 00 00 00 00 00 00 00 00 00 00 00
0210: 00 00 00 00 00 00 00 00 00 00 00 00 00 00 00 00
0220: 00 00 00 00 00 00 00 00 00 00 00 00 00 00 00 00
0230: 00 00 00 00 00 00 00 00 00 00 00 00 00 00 00 00
0240: 00 00 00 00 00 00 00 00 00 00 00 00 00 00 00 00
0250: 00 00 00 00 00 00 00 00 00 00 00 00 00 00 00 00
0260: 00 00 00 00 00 00 00 00 00 00 00 00 00 00 00 00
0270: 00 00 00 00 00 00 00 00 00 00 00 00 00 00 00 00
0280: 00 00 00 00 00 00 00 00 00 00 00 00 00 00 00 00
0290: 00 00 00 00 00 00 00 00 00 00 00 00 00 00 00 00
02a0: 00 00 00 00 00 00 00 00 00 00 00 00 00 00 00 00
02b0: 00 00 00 00 00 00 00 00 00 00 00 00 00 00 00 00
02c0: 00 00 00 00 00 00 00 00 00 00 00 00 00 00 00 00
02d0: 00 00 00 00 00 00 00 00 00 00 00 00 00 00 00 00
02e0: 00 00 00 00 00 00 00 00 00 00 00 00 00 00 00 00
02f0: 00 00 00 00 00 00 00 00 00 00 00 00 00 00 00 00
0300: 00 00 00 00 00 00 00 00 00 00 00 00 00 00 00 00
0310: 00 00 00 00 00 00 00 00 00 00 00 00 00 00 00 00
0320: 00 00 00 00 00 00 00 00 00 00 00 00 00 00 00 00
0330: 00 00 00 00 00 00 00 00 00 00 00 00 00 00 00 00
0340: 00 00 00 00 00 00 00 00 00 00 00 00 00 00 00 00
0350: 00 00 00 00 00 00 00 00 00 00 00 00 00 00 00 00
0360: 00 00 00 00 00 00 00 00 00 00 00 00 00 00 00 00
0370: 00 00 00 00 00 00 00 00 00 00 00 00 00 00 00 00
0380: 00 00 00 00 00 00 00 00 00 00 00 00 00 00 00 00
0390: 00 00 00 00 00 00 00 00 00 00 00 00 00 00 00 00
03a0: 00 00 00 00 00 00 00 00 00 00 00 00 00 00 00 00
03b0: 00 00 00 00 00 00 00 00 00 00 00 00 00 00 00 00
03c0: 00 00 00 00 00 00 00 00 00 00 00 00 00 00 00 00
03d0: 00 00 00 00 00 00 00 00 00 00 00 00 00 00 00 00
03e0: 00 00 00 00 00 00 00 00 00 00 00 00 00 00 00 00
03f0: 00 00 00 00 00 00 00 00 00 00 00 00 00 00 00 00
0400: 00 00 00 00 00 00 00 00 00 00 00 00 00 00 00 00
0410: 00 00 00 00 00 00 00 00 00 00 0e 00 80 84 00 00
0420: 00 00 00 60 00 00 10 00 00 00 00 00 11 20 06 00
0430: 00 20 00 00 00 00 00 00 14 00 00 00 01 00 00 04
0440: 03 19 00 00 00 10 60 00 00 00 00 00 00 00 00 00
0450: 00 00 00 00 00 00 00 00 0f 00 28 00 00 00 00 80
0460: 24 12 60 b0 c4 09 40 06 00 00 00 00 00 00 00 00
0470: 00 00 00 00 6d 05 69 05 8f 00 f2 06 15 ad 08 00
0480: 00 00 00 00 01 00 00 00 24 00 00 00 90 00 20 01
0490: 0a 00 f0 00 00 00 00 00 00 00 00 00 00 00 00 00
04a0: 00 00 00 00 00 00 00 00 00 00 00 00 00 00 00 00
04b0: 00 00 00 00 00 00 00 00 00 00 00 00 00 00 00 00
04c0: 00 00 00 00 00 00 00 00 00 00 00 00 00 00 00 00
04d0: 00 00 00 00 00 00 00 00 00 00 00 00 00 00 00 00
04e0: 00 00 00 00 00 00 00 00 00 00 00 00 00 00 00 00
04f0: 00 00 00 00 00 00 00 00 00 00 00 00 00 00 00 00
0500: 00 00 00 00 00 00 00 00 00 00 00 00 00 00 00 00
0510: 00 00 00 00 00 00 00 00 00 00 00 00 00 00 00 00
0520: 00 00 00 00 00 00 00 00 00 00 00 00 00 00 00 00
0530: 00 00 00 00 00 00 00 00 00 00 00 00 00 00 00 00
0540: 00 00 00 00 00 00 00 00 00 00 00 00 00 00 00 00
0550: 00 00 00 00 00 00 00 00 00 00 00 00 00 00 00 00
0560: 00 00 00 00 00 00 00 00 00 00 00 00 00 00 00 00
0570: 00 00 00 00 00 00 00 00 00 00 00 00 00 00 00 00
0580: 00 00 00 00 00 00 00 00 00 00 00 00 00 00 00 00
0590: 00 00 00 00 00 00 00 00 00 00 00 00 00 00 00 00
05a0: 00 00 00 00 00 00 00 00 00 00 00 00 00 00 00 00
05b0: 00 00 00 00 00 00 00 00 00 00 00 00 00 00 00 00
05c0: 00 00 00 00 00 00 00 00 00 00 00 00 00 00 00 00
05d0: 00 00 00 00 00 00 00 00 00 00 00 00 00 00 00 00
05e0: 00 00 00 00 00 00 00 00 00 00 00 00 00 00 00 00
05f0: 00 00 00 00 00 00 00 00 00 00 00 00 00 00 00 00
0600: 0b 00 01 00 01 00 41 02 02 00 41 01 00 00 00 00
0610: 01 00 00 00 01 00 01 00 01 00 00 00 00 00 00 00
0620: 00 00 00 00 00 00 00 00 00 00 00 00 00 00 00 00
0630: 00 00 00 00 00 00 00 00 00 00 00 00 00 00 00 00
0640: 00 00 00 00 00 00 00 00 00 00 00 00 00 00 00 00
0650: 00 00 00 00 00 00 00 00 00 00 00 00 00 00 00 00
0660: 00 00 00 00 00 00 00 00 00 00 00 00 00 00 00 00
0670: 00 00 00 00 00 00 00 00 00 00 00 00 00 00 00 00
0680: 00 00 00 00 00 00 00 00 00 00 00 00 00 00 00 00
0690: 00 00 00 00 00 00 00 00 00 00 00 00 00 00 00 00
06a0: 00 00 00 00 00 00 00 00 00 00 00 00 00 00 00 00
06b0: 00 00 00 00 00 00 00 00 00 00 00 00 00 00 00 00
06c0: 00 00 00 00 00 00 00 00 00 00 00 00 00 00 00 00
06d0: 00 00 00 00 00 00 00 00 00 00 00 00 00 00 00 00
06e0: 00 00 00 00 00 00 00 00 00 00 00 00 00 00 00 00
06f0: 00 00 00 00 00 00 00 00 00 00 00 00 00 00 00 00
0700: 00 00 00 00 00 00 00 00 00 00 00 00 00 00 00 00
0710: 00 00 00 00 00 00 00 00 00 00 00 00 00 00 00 00
0720: 00 00 00 00 00 00 00 00 00 00 00 00 00 00 00 00
0730: 00 00 00 00 00 00 00 00 00 00 00 00 00 00 00 00
0740: 00 00 00 00 00 00 00 00 00 00 00 00 00 00 00 00
0750: 00 00 00 00 00 00 00 00 00 00 00 00 00 00 00 00
0760: 00 00 00 00 00 00 00 00 00 00 00 00 00 00 00 00
0770: 00 00 00 00 00 00 00 00 00 00 00 00 00 00 00 00
0780: 00 00 00 00 00 00 00 00 00 00 00 00 00 00 00 00
0790: 00 00 00 00 00 00 00 00 00 00 00 00 00 00 00 00
07a0: 00 00 00 00 00 00 00 00 00 00 00 00 00 00 00 00
07b0: 00 00 00 00 00 00 00 00 00 00 00 00 00 00 00 00
07c0: 00 00 00 00 00 00 00 00 00 00 00 00 00 00 00 00
07d0: 00 00 00 00 00 00 00 00 00 00 00 00 00 00 00 00
07e0: 00 00 00 00 00 00 00 00 00 00 00 00 00 00 00 00
07f0: 00 00 00 00 00 00 00 00 00 00 00 00 00 00 00 00
0800: 00 00 00 00 00 00 00 00 00 00 00 00 00 00 00 00
0810: 00 00 00 00 00 00 00 00 00 00 00 00 00 00 00 00
0820: 00 00 00 00 00 00 00 00 00 00 00 00 00 00 00 00
0830: 00 00 00 00 00 00 00 00 00 00 00 00 00 00 00 00
0840: 00 00 00 00 00 00 00 00 00 00 00 00 00 00 00 00
0850: 00 00 00 00 00 00 00 00 00 00 00 00 00 00 00 00
0860: 00 00 00 00 00 00 00 00 00 00 00 00 00 00 00 00
0870: 00 00 00 00 00 00 00 00 00 00 00 00 00 00 00 00
0880: 00 00 00 00 00 00 00 00 00 00 00 00 00 00 00 00
0890: 00 00 00 00 00 00 00 00 00 00 00 00 00 00 00 00
08a0: 00 00 00 00 00 00 00 00 00 00 00 00 00 00 00 00
08b0: 00 00 00 00 00 00 00 00 00 00 00 00 00 00 00 00
08c0: 00 00 00 00 00 00 00 00 00 00 00 00 00 00 00 00
08d0: 00 00 00 00 00 00 00 00 00 00 00 00 00 00 00 00
08e0: 00 00 00 00 00 00 00 00 00 00 00 00 00 00 00 00
08f0: 00 00 00 00 00 00 00 00 00 00 00 00 00 00 00 00
0900: 00 00 00 00 00 00 00 00 00 00 00 00 00 00 00 00
0910: 00 00 00 00 00 00 00 00 00 00 00 00 00 00 00 00
0920: 00 00 00 00 00 00 00 00 00 00 00 00 00 00 00 00
0930: 00 00 00 00 00 00 00 00 00 00 00 00 00 00 00 00
0940: 00 00 00 00 00 00 00 00 00 00 00 00 00 00 00 00
0950: 00 00 00 00 00 00 00 00 00 00 00 00 00 00 00 00
0960: 00 00 00 00 00 00 00 00 00 00 00 00 00 00 00 00
0970: 00 00 00 00 00 00 00 00 00 00 00 00 00 00 00 00
0980: 00 00 00 00 00 00 00 00 00 00 00 00 00 00 00 00
0990: 00 00 00 00 00 00 00 00 00 00 00 00 00 00 00 00
09a0: 00 00 00 00 00 00 00 00 00 00 00 00 00 00 00 00
09b0: 00 00 00 00 00 00 00 00 00 00 00 00 00 00 00 00
09c0: 00 00 00 00 00 00 00 00 00 00 00 00 00 00 00 00
09d0: 00 00 00 00 00 00 00 00 00 00 00 00 00 00 00 00
09e0: 00 00 00 00 00 00 00 00 00 00 00 00 00 00 00 00
09f0: 00 00 00 00 00 00 00 00 00 00 00 00 00 00 00 00
0a00: 00 00 00 00 00 00 00 00 00 00 00 00 00 00 00 00
0a10: 00 00 00 00 00 00 00 00 00 00 00 00 00 00 00 00
0a20: 00 00 00 00 00 00 00 00 00 00 00 00 00 00 00 00
0a30: 00 00 00 00 00 00 00 00 00 00 00 00 00 00 00 00
0a40: 00 00 00 00 00 00 00 00 00 00 00 00 00 00 00 00
0a50: 00 00 00 00 00 00 00 00 00 00 00 00 00 00 00 00
0a60: 00 00 00 00 00 00 00 00 00 00 00 00 00 00 00 00
0a70: 00 00 00 00 00 00 00 00 00 00 00 00 00 00 00 00
0a80: 00 00 00 00 00 00 00 00 00 00 00 00 00 00 00 00
0a90: 00 00 00 00 00 00 00 00 00 00 00 00 00 00 00 00
0aa0: 00 00 00 00 00 00 00 00 00 00 00 00 00 00 00 00
0ab0: 00 00 00 00 00 00 00 00 00 00 00 00 00 00 00 00
0ac0: 00 00 00 00 00 00 00 00 00 00 00 00 00 00 00 00
0ad0: 00 00 00 00 00 00 00 00 00 00 00 00 00 00 00 00
0ae0: 00 00 00 00 00 00 00 00 00 00 00 00 00 00 00 00
0af0: 00 00 00 00 00 00 00 00 00 00 00 00 00 00 00 00
0b00: 00 00 00 00 00 00 00 00 00 00 00 00 00 00 00 00
0b10: 00 00 00 00 00 00 00 00 00 00 00 00 00 00 00 00
0b20: 00 00 00 00 00 00 00 00 00 00 00 00 00 00 00 00
0b30: 00 00 00 00 00 00 00 00 00 00 00 00 00 00 00 00
0b40: 00 00 00 00 00 00 00 00 00 00 00 00 00 00 00 00
0b50: 00 00 00 00 00 00 00 00 00 00 00 00 00 00 00 00
0b60: 00 00 00 00 00 00 00 00 00 00 00 00 00 00 00 00
0b70: 00 00 00 00 00 00 00 00 00 00 00 00 00 00 00 00
0b80: 00 00 00 00 00 00 00 00 00 00 00 00 00 00 00 00
0b90: 00 00 00 00 00 00 00 00 00 00 00 00 00 00 00 00
0ba0: 00 00 00 00 00 00 00 00 00 00 00 00 00 00 00 00
0bb0: 00 00 00 00 00 00 00 00 00 00 00 00 00 00 00 00
0bc0: 00 00 00 00 00 00 00 00 00 00 00 00 00 00 00 00
0bd0: 00 00 00 00 00 00 00 00 00 00 00 00 00 00 00 00
0be0: 00 00 00 00 00 00 00 00 00 00 00 00 00 00 00 00
0bf0: 00 00 00 00 00 00 00 00 00 00 00 00 00 00 00 00
0c00: 00 00 00 00 00 00 00 00 00 00 00 00 00 00 00 00
0c10: 00 00 00 00 00 00 00 00 00 00 00 00 00 00 00 00
0c20: 00 00 00 00 00 00 00 00 00 00 00 00 00 00 00 00
0c30: 00 00 00 00 00 00 00 00 00 00 00 00 00 00 00 00
0c40: 00 00 00 00 00 00 00 00 00 00 00 00 00 00 00 00
0c50: 00 00 00 00 00 00 00 00 00 00 00 00 00 00 00 00
0c60: 00 00 00 00 00 00 00 00 00 00 00 00 00 00 00 00
0c70: 00 00 00 00 00 00 00 00 00 00 00 00 00 00 00 00
0c80: 00 00 00 00 00 00 00 00 00 00 00 00 00 00 00 00
0c90: 00 00 00 00 00 00 00 00 00 00 00 00 00 00 00 00
0ca0: 00 00 00 00 00 00 00 00 00 00 00 00 00 00 00 00
0cb0: 00 00 00 00 00 00 00 00 00 00 00 00 00 00 00 00
0cc0: 00 00 00 00 00 00 00 00 00 00 00 00 00 00 00 00
0cd0: 00 00 00 00 00 00 00 00 00 00 00 00 00 00 00 00
0ce0: 00 00 00 00 00 00 00 00 00 00 00 00 00 00 00 00
0cf0: 00 00 00 00 00 00 00 00 00 00 00 00 00 00 00 00
0d00: 00 00 00 00 00 00 00 00 00 00 00 00 00 00 00 00
0d10: 00 00 00 00 00 00 00 00 00 00 00 00 00 00 00 00
0d20: 00 00 00 00 00 00 00 00 00 00 00 00 00 00 00 00
0d30: 00 00 00 00 00 00 00 00 00 00 00 00 00 00 00 00
0d40: 00 00 00 00 00 00 00 00 00 00 00 00 00 00 00 00
0d50: 00 00 00 00 00 00 00 00 00 00 00 00 00 00 00 00
0d60: 00 00 00 00 00 00 00 00 00 00 00 00 00 00 00 00
0d70: 00 00 00 00 00 00 00 00 00 00 00 00 00 00 00 00
0d80: 00 00 00 00 00 00 00 00 00 00 00 00 00 00 00 00
0d90: 00 00 00 00 00 00 00 00 00 00 00 00 00 00 00 00
0da0: 00 00 00 00 00 00 00 00 00 00 00 00 00 00 00 00
0db0: 00 00 00 00 00 00 00 00 00 00 00 00 00 00 00 00
0dc0: 00 00 00 00 00 00 00 00 00 00 00 00 00 00 00 00
0dd0: 00 00 00 00 00 00 00 00 00 00 00 00 00 00 00 00
0de0: 00 00 00 00 00 00 00 00 00 00 00 00 00 00 00 00
0df0: 00 00 00 00 00 00 00 00 00 00 00 00 00 00 00 00
0e00: 00 00 00 00 00 00 00 00 00 00 00 00 00 00 00 00
0e10: 00 00 00 00 00 00 00 00 00 00 00 00 00 00 00 00
0e20: 00 00 00 00 00 00 00 00 00 00 00 00 00 00 00 00
0e30: 00 00 00 00 00 00 00 00 00 00 00 00 00 00 00 00
0e40: 00 00 00 00 00 00 00 00 00 00 00 00 00 00 00 00
0e50: 00 00 00 00 00 00 00 00 00 00 00 00 00 00 00 00
0e60: 00 00 00 00 00 00 00 00 00 00 00 00 00 00 00 00
0e70: 00 00 00 00 00 00 00 00 00 00 00 00 00 00 00 00
0e80: 00 00 00 00 00 00 00 00 00 00 00 00 00 00 00 00
0e90: 00 00 00 00 00 00 00 00 00 00 00 00 00 00 00 00
0ea0: 00 00 00 00 00 00 00 00 00 00 00 00 00 00 00 00
0eb0: 00 00 00 00 00 00 00 00 00 00 00 00 00 00 00 00
0ec0: 00 00 00 00 00 00 00 00 00 00 00 00 00 00 00 00
0ed0: 00 00 00 00 00 00 00 00 00 00 00 00 00 00 00 00
0ee0: 00 00 00 00 00 00 00 00 00 00 00 00 00 00 00 00
0ef0: 00 00 00 00 00 00 00 00 00 00 00 00 00 00 00 00
0f00: 00 00 00 00 00 00 00 00 00 00 00 00 00 00 00 00
0f10: 00 00 00 00 00 00 00 00 00 00 00 00 00 00 00 00
0f20: 00 00 00 00 00 00 00 00 00 00 00 00 00 00 00 00
0f30: 00 00 00 00 00 00 00 00 00 00 00 00 00 00 00 00
0f40: 00 00 00 00 00 00 00 00 00 00 00 00 00 00 00 00
0f50: 00 00 00 00 00 00 00 00 00 00 00 00 00 00 00 00
0f60: 00 00 00 00 00 00 00 00 00 00 00 00 00 00 00 00
0f70: 00 00 00 00 00 00 00 00 00 00 00 00 00 00 00 00
0f80: 00 00 00 00 00 00 00 00 00 00 00 00 00 00 00 00
0f90: 00 00 00 00 00 00 00 00 00 00 00 00 00 00 00 00
0fa0: 00 00 00 00 00 00 00 00 00 00 00 00 00 00 00 00
0fb0: 00 00 00 00 00 00 00 00 00 00 00 00 00 00 00 00
0fc0: 00 00 00 00 00 00 00 00 00 00 00 00 00 00 00 00
0fd0: 00 00 00 00 00 00 00 00 00 00 00 00 00 00 00 00
0fe0: 00 00 00 00 00 00 00 00 00 00 00 00 00 00 00 00
0ff0: 00 00 00 00 00 00 00 00 00 00 00 00 00 00 00 00


Error: Dumping MSRs on this CPU (0x010670) is not (yet) supported.



============= AMBs ============


============= SPI / BIOS CNTL =============

BIOS_CNTL = 0x0000 (IO)

0x0000 = BIOSWE - write enable
0x0000 = BLE - lock enable
0x0000 = SPI Read configuration
0x0000 = TopSwapStatus
0x0000 = reserved

============= SPI Bar ==============

0x00001fff = BFPR - BIOS Flash primary region
0x00002008 = HSFSTS - Hardware Sequencing Flash Status
0x00000000 = HSFCTL - Hardware Sequencing Flash Control
0x00000002 = FADDR - Flash Address
0x00000000 = Reserved
0xc2ffffff = FDATA0
0x00000202 = FRACC - Flash Region AError: Dumping AMBs on this MCH is not (yet) supported.
[open@archlinux util]$ sudo inteltool -g | tee gpio_raw.log
CPU: ID 0x1067a, Processor Type 0x0, Family 0x6, Model 0x17, Stepping 0xa
Northbridge: 8086:2a40 (GL40/GS40/GM45/GS45/PM45)
Southbridge: 8086:2919 (ICH9M)

============= GPIOS =============

GPIOBASE = 0x0500 (IO)

gpiobase+0x0000: 0x1dfe73ce (GPIO_USE_SEL)
gpiobase+0x0004: 0xe0387fcf (GP_IO_SEL)
gpiobase+0x0008: 0x00000000 (RESERVED)
gpiobase+0x000c: 0xeaeeedf5 (GP_LVL)
gpiobase+0x0010: 0x00000000 (RESERVED)
gpiobase+0x0014: 0x00000000 (RESERVED)
gpiobase+0x0018: 0x00000000 (GPO_BLINK)
gpiobase+0x001c: 0x00000000 (GP_SER_BLINK)
gpiobase+0x0020: 0x00080000 (GP_SB_CMDSTS)
gpiobase+0x0024: 0x00000000 (GP_SB_DATA)
gpiobase+0x0028: 0x00000000 (RESERVED)
gpiobase+0x002c: 0x000071c4 (GPI_INV)
gpiobase+0x0030: 0x038300fe (GPIO_USE_SEL2)
gpiobase+0x0034: 0x0ed5ffb0 (GP_IO_SEL2)
gpiobase+0x0038: 0x0f7fffef (GP_LVL2)
gpiobase+0x003c: 0x00000000 (RESERVED)


[open@archlinux util]$ sudo inteltool -g | grep -i gpio
============= GPIOS =============
GPIOBASE = 0x0500 (IO)
gpiobase+0x0000: 0x1dfe73ce (GPIO_USE_SEL)
gpiobase+0x0004: 0xe0387fcf (GP_IO_SEL)
gpiobase+0x0008: 0x00000000 (RESERVED)
gpiobase+0x000c: 0xeaeeedf5 (GP_LVL)
gpiobase+0x0010: 0x00000000 (RESERVED)
gpiobase+0x0014: 0x00000000 (RESERVED)
gpiobase+0x0018: 0x00000000 (GPO_BLINK)
gpiobase+0x001c: 0x00000000 (GP_SER_BLINK)
gpiobase+0x0020: 0x00080000 (GP_SB_CMDSTS)
gpiobase+0x0024: 0x00000000 (GP_SB_DATA)
gpiobase+0x0028: 0x00000000 (RESERVED)
gpiobase+0x002c: 0x000071c4 (GPI_INV)
gpiobase+0x0030: 0x038300fe (GPIO_USE_SEL2)
gpiobase+0x0034: 0x0ed5ffb0 (GP_IO_SEL2)
gpiobase+0x0038: 0x0f7fffef (GP_LVL2)
gpiobase+0x003c: 0x00000000 (RESERVED)
[open@archlinux util]$ grep -R "GPIO" *.dsl
grep -R "GpioInt" *.dsl
grep: *.dsl: No such file or directory
grep: *.dsl: No such file or directory
[open@archlinux util]$ intel_gpu_top
bash: intel_gpu_top: command not found
[open@archlinux util]$ sudo Pace man -S intel_gpu_top                                                                                                                 
sudo: Pace: command not found
[open@archlinux util]$ sudo Pacman man -S intel_gpu_top                                                                                                               
sudo: Pacman: command not found
[open@archlinux util]$ sudo Pacman -S intel_gpu_top                                                                                                                   
sudo: Pacman: command not found
[open@archlinux util]$ sudo pacman -S intel_gpu_top                                                                                                                   
error: target not found: intel_gpu_top
[open@archlinux util]$ yay -S intel_gpu_top                                                                                                                           
 -> No AUR package found for intel_gpu_top
 there is nothing to do
[open@archlinux util]$ intel_gpu_top
bash: intel_gpu_top: command not found
[open@archlinux util]$ sudo intel_reg dump > intel_display_regs.txt
sudo: intel_reg: command not found
[open@archlinux util]$ sudo cat /sys/kernel/debug/dri/0/i915_vbt > vbt.bin
cat: /sys/kernel/debug/dri/0/i915_vbt: No such file or directory
[open@archlinux util]$ intel_vbt_decode vbt.bin > vbt.txt
bash: intel_vbt_decode: command not found
[open@archlinux util]$ modetest -c
trying to open device '/dev/dri/card0'... done
opened device `DRM driver for simple-framebuffer platform devices` on driver `simpledrm` (version 1.0.0 at 0)
Connectors:
id	encoder	status		name		size (mm)	modes	encoders
36	35	connected	Unknown-1      	169x127		1	35
  modes:
	index name refresh (Hz) hdisp hss hse htot vdisp vss vse vtot
  #0 640x480 60.00 640 640 640 640 480 480 480 480 18432 flags: ; type: preferred, driver
  props:
	1 EDID:
		flags: immutable blob
		blobs:

		value:
	2 DPMS:
		flags: enum
		enums: On=0 Standby=1 Suspend=2 Off=3
		value: 0
	5 link-status:
		flags: enum
		enums: Good=0 Bad=1
		value: 0
	6 non-desktop:
		flags: immutable range
		values: 0 1
		value: 0
	4 TILE:
		flags: immutable blob
		blobs:

		value:

[open@archlinux util]$ 
